Rule ID,Resource ID,Compliance,Exception Reason,Rule Level,Rule Info
"AwsSolutions-EC23","CdkNagScanStack/--run--scan--src--deployment--database--crdr-reconciliation--src--restore-reconcile-orders-ssm.yaml/LambdaSecurityGroup","Compliant","N/A","Error","The Security Group allows for 0.0.0.0/0 or ::/0 inbound access."
"AwsSolutions-EC27","CdkNagScanStack/--run--scan--src--deployment--database--crdr-reconciliation--src--restore-reconcile-orders-ssm.yaml/LambdaSecurityGroup","Compliant","N/A","Error","The Security Group does not have a description."
"AwsSolutions-EC23","CdkNagScanStack/--run--scan--src--deployment--database--crdr-reconciliation--src--restore-reconcile-orders-ssm.yaml/LambdaSecurityGroupInboundRule","Compliant","N/A","Error","The Security Group allows for 0.0.0.0/0 or ::/0 inbound access."
"AwsSolutions-IAM4","CdkNagScanStack/--run--scan--src--deployment--database--crdr-reconciliation--src--restore-reconcile-orders-ssm.yaml/AutomationExecutionRole","Compliant","N/A","Error","The IAM user, role, or group uses AWS managed policies."
"AwsSolutions-IAM5","CdkNagScanStack/--run--scan--src--deployment--database--crdr-reconciliation--src--restore-reconcile-orders-ssm.yaml/AutomationExecutionRole","Compliant","N/A","Error","The IAM entity contains wildcard permissions and does not have a cdk-nag rule suppression with evidence for those permission."
